{
  "run_id": "20260509-104523-a1b2c3d-9e8f7d",
  "primary": {
    "name": "acc",
    "value": 0.671,
    "n": 1000
  },
  "secondary": [
    {"name": "f1", "value": 0.65},
    {"name": "throughput_qps", "value": 12.4}
  ],
  "elapsed_seconds": 3600,
  "meta": {
    "git_dirty": false,
    "cuda_version": "12.4",
    "torch_version": "2.5.0",
    "gpu": "NVIDIA A100-SXM4-80GB",
    "num_gpus": 1
  },
  "cost_estimate": {
    "usd": 2.0,
    "duration_h": 1.0,
    "gpu_type": "A100-80GB-SXM",
    "gpu_count": 1,
    "usd_per_hour": 2.0,
    "pricing_source": "AWS p4de",
    "estimated_at": "2026-05-09T15:00:00Z"
  }
}
